Sede,departamento,direccion
Cardales Cayala, Guatemala, Bulevar Rafael Landivar 37-01 Cdad. de Guatemala
Los Proceres, Guatemala, Bulevar los Proceres Cdad. de Guatemala 01010
Miraflores, Guatemala, 21 Avenida 4-32 Cdad. de Guatemala
Oakland Mall, Guatemala, Ciudad de Diag. 6 13-01 Cdad. de Guatemala 01010
Pradera Concepcion, Guatemala, Carr. Condado Concepcion Guatemala
Centro Comercial Metroplaza Mundo Maya, Peten,Flores 17029
Centro Comericla Interplaza Xela, Quetzaltenango,Km. 205 Carretera a San Marcos 09032